{"schema_version":"1.0.0","id":"context-1","business_flow_id":"flow_launch001","source_type":"deliverable","source_id":"deliverable-research","sensitivity":"internal","allowed_agents":["writer-002"],"content_sha256":"bbbbbbbbbbbbbbbbbbbbbbbbbbbbbbbbbbbbbbbbbbbbbbbbbbbbbbbbbbbbbbbb","added_by":"runtime"}
